{
  "event_history": [
    {
      "at": "20260813T020113Z",
      "event_id": "4822d22abe17c20f69f86e7fa16f33bf7b29d95c59b1b8232c525a904601738b",
      "observation_id": "721fe6bcd766f4fa67415ea0ca5c63dcbffaca1a6ee68924531ae0e892cbaa5c",
      "ordinal": 1537,
      "resulting_state": "pending",
      "state": "pending",
      "type": "observation"
    },
    {
      "at": "20260813T020113Z",
      "event_id": "499f8ff3043db73072e788cc179fc7e7ded05a062300a3e8fbf1455bb2721e05",
      "ordinal": 1538,
      "reason": "dice seed generation procedure already represented by reddit-dice-seed-generation",
      "resulting_state": "assessed",
      "type": "verdict",
      "verdict": "dismissed"
    }
  ],
  "first_ordinal": 1537,
  "first_recorded": "20260813T020113Z",
  "head": "499f8ff3043db73072e788cc179fc7e7ded05a062300a3e8fbf1455bb2721e05",
  "identity": "reddit:1vkexpv",
  "last_ordinal": 1538,
  "last_recorded": "20260813T020113Z",
  "native_id": "1vkexpv",
  "observations": [
    {
      "legacy_event_time_basis": "verdict-stamp",
      "legacy_line": "- 2026-08-10 [Reality check for seed generation](https://www.reddit.com/r/Bitcoin/comments/1vkexpv/reality_check_for_seed_generation/) by Neverjetni, 35 comments (r/Bitcoin) [body] -> dismissed: dice seed generation procedure already represented by reddit-dice-seed-generation (20260813T020113Z)",
      "legacy_line_number": 814,
      "legacy_path": "DISCOVERY.md",
      "legacy_queue_rank": 780,
      "legacy_section": "Assessed",
      "observation_id": "721fe6bcd766f4fa67415ea0ca5c63dcbffaca1a6ee68924531ae0e892cbaa5c",
      "url": "https://www.reddit.com/r/Bitcoin/comments/1vkexpv/reality_check_for_seed_generation/"
    }
  ],
  "platform": "reddit",
  "queue_rank": 780,
  "retry_history": [],
  "schema": 1,
  "state": "assessed",
  "url": "https://www.reddit.com/r/Bitcoin/comments/1vkexpv/reality_check_for_seed_generation/",
  "verdict": {
    "at": "20260813T020113Z",
    "event_id": "499f8ff3043db73072e788cc179fc7e7ded05a062300a3e8fbf1455bb2721e05",
    "kind": "dismissed",
    "reason": "dice seed generation procedure already represented by reddit-dice-seed-generation"
  },
  "verdict_history": [
    {
      "at": "20260813T020113Z",
      "event_id": "499f8ff3043db73072e788cc179fc7e7ded05a062300a3e8fbf1455bb2721e05",
      "kind": "dismissed",
      "reason": "dice seed generation procedure already represented by reddit-dice-seed-generation"
    }
  ]
}
