{
  "event_history": [
    {
      "at": "20260807T103900Z",
      "event_id": "beffb22a77de12649360dcf54acab5df4339d4ca4cd7b8f02b4e19f68bfcd66c",
      "observation_id": "e5004e44d36c8ae87e6617f6da15ce60155b923cb003330d50036fdbf9fe3d5c",
      "ordinal": 825,
      "resulting_state": "pending",
      "state": "pending",
      "type": "observation"
    },
    {
      "at": "20260807T103900Z",
      "event_id": "2b0f93451af961f68ae028f0b75c143f6df021f5be201c9835508c5452eec6ef",
      "ordinal": 826,
      "reason": "hardware-wallet shopping question; migration-destination theme covered by registered threads",
      "resulting_state": "assessed",
      "type": "verdict",
      "verdict": "dismissed"
    }
  ],
  "first_ordinal": 825,
  "first_recorded": "20260807T103900Z",
  "head": "2b0f93451af961f68ae028f0b75c143f6df021f5be201c9835508c5452eec6ef",
  "identity": "reddit:1vhevsg",
  "last_ordinal": 826,
  "last_recorded": "20260807T103900Z",
  "native_id": "1vhevsg",
  "observations": [
    {
      "legacy_event_time_basis": "verdict-stamp",
      "legacy_line": "- 2026-08-06 [What are everyone’s thoughts on Bitkey?](https://www.reddit.com/r/Bitcoin/comments/1vhevsg/what_are_everyones_thoughts_on_bitkey/) by EuphoricDealer4133, 35 comments (r/Bitcoin) -> dismissed: hardware-wallet shopping question; migration-destination theme covered by registered threads (20260807T103900Z)",
      "legacy_line_number": 465,
      "legacy_path": "DISCOVERY.md",
      "legacy_queue_rank": 431,
      "legacy_section": "Assessed",
      "observation_id": "e5004e44d36c8ae87e6617f6da15ce60155b923cb003330d50036fdbf9fe3d5c",
      "url": "https://www.reddit.com/r/Bitcoin/comments/1vhevsg/what_are_everyones_thoughts_on_bitkey/"
    }
  ],
  "platform": "reddit",
  "queue_rank": 431,
  "retry_history": [],
  "schema": 1,
  "state": "assessed",
  "url": "https://www.reddit.com/r/Bitcoin/comments/1vhevsg/what_are_everyones_thoughts_on_bitkey/",
  "verdict": {
    "at": "20260807T103900Z",
    "event_id": "2b0f93451af961f68ae028f0b75c143f6df021f5be201c9835508c5452eec6ef",
    "kind": "dismissed",
    "reason": "hardware-wallet shopping question; migration-destination theme covered by registered threads"
  },
  "verdict_history": [
    {
      "at": "20260807T103900Z",
      "event_id": "2b0f93451af961f68ae028f0b75c143f6df021f5be201c9835508c5452eec6ef",
      "kind": "dismissed",
      "reason": "hardware-wallet shopping question; migration-destination theme covered by registered threads"
    }
  ]
}
