{
  "event_history": [
    {
      "at": "20260809T150625Z",
      "event_id": "ea9e3a6fa8b4af7fda7ccb148e38968a6d00150166afef7e38ddeff0882b61a2",
      "observation_id": "24def6ecd4a7cf8664cb9ab3ee4f9571ec7dfbc6564e56fef3d5a7f0531c67c4",
      "ordinal": 1314,
      "resulting_state": "pending",
      "state": "pending",
      "type": "observation"
    },
    {
      "at": "20260809T150625Z",
      "event_id": "8a39812730fcd7f9afeab1f1b4f9ab500433c81ce8d3a4bca81eeaa3a98dd3a6",
      "ordinal": 1315,
      "reason": "content-free slogan with no incident claim",
      "resulting_state": "assessed",
      "type": "verdict",
      "verdict": "dismissed"
    }
  ],
  "first_ordinal": 1314,
  "first_recorded": "20260809T150625Z",
  "head": "8a39812730fcd7f9afeab1f1b4f9ab500433c81ce8d3a4bca81eeaa3a98dd3a6",
  "identity": "x:2082276626495103051",
  "last_ordinal": 1315,
  "last_recorded": "20260809T150625Z",
  "native_id": "2082276626495103051",
  "observations": [
    {
      "legacy_event_time_basis": "verdict-stamp",
      "legacy_line": "- 2026-07-29 [@glxyresearch repost (text available during approved intake)](https://x.com/intangiblecoins/status/2082276626495103051) (X @glxyresearch) -> dismissed: content-free slogan with no incident claim (20260809T150625Z)",
      "legacy_line_number": 723,
      "legacy_path": "DISCOVERY.md",
      "legacy_queue_rank": 689,
      "legacy_section": "Assessed",
      "observation_id": "24def6ecd4a7cf8664cb9ab3ee4f9571ec7dfbc6564e56fef3d5a7f0531c67c4",
      "url": "https://x.com/intangiblecoins/status/2082276626495103051"
    }
  ],
  "platform": "x",
  "queue_rank": 689,
  "retry_history": [],
  "schema": 1,
  "state": "assessed",
  "url": "https://x.com/intangiblecoins/status/2082276626495103051",
  "verdict": {
    "at": "20260809T150625Z",
    "event_id": "8a39812730fcd7f9afeab1f1b4f9ab500433c81ce8d3a4bca81eeaa3a98dd3a6",
    "kind": "dismissed",
    "reason": "content-free slogan with no incident claim"
  },
  "verdict_history": [
    {
      "at": "20260809T150625Z",
      "event_id": "8a39812730fcd7f9afeab1f1b4f9ab500433c81ce8d3a4bca81eeaa3a98dd3a6",
      "kind": "dismissed",
      "reason": "content-free slogan with no incident claim"
    }
  ]
}
