{
  "event_history": [
    {
      "at": "20260813T131342Z",
      "event_id": "cbe4f7b7d99f593b53079fcc1992e92b5f421d3c860910aca0010ecccf7424cc",
      "observation_id": "8f7545c5e4d62222e039ba0c42e1641d424b8fdcdf587f11df4b7b835c9684b2",
      "ordinal": 1719,
      "resulting_state": "pending",
      "state": "pending",
      "type": "observation"
    },
    {
      "at": "20260813T131342Z",
      "event_id": "216d2d16b8095fb2f5cd618ecb716aa09770b0e05d88b754236b1d40e03abae9",
      "ordinal": 1720,
      "reason": "already represented by kloaec-slipstream-psbt-tool",
      "resulting_state": "assessed",
      "type": "verdict",
      "verdict": "dismissed"
    }
  ],
  "first_ordinal": 1719,
  "first_recorded": "20260813T131342Z",
  "head": "216d2d16b8095fb2f5cd618ecb716aa09770b0e05d88b754236b1d40e03abae9",
  "identity": "x:2084440673894138236",
  "last_ordinal": 1720,
  "last_recorded": "20260813T131342Z",
  "native_id": "2084440673894138236",
  "observations": [
    {
      "legacy_event_time_basis": "verdict-stamp",
      "legacy_line": "- 2026-08-04 [@KLoaec post (text available during approved intake)](https://x.com/KLoaec/status/2084440673894138236) (X @KLoaec) -> dismissed: already represented by kloaec-slipstream-psbt-tool (20260813T131342Z)",
      "legacy_line_number": 905,
      "legacy_path": "DISCOVERY.md",
      "legacy_queue_rank": 871,
      "legacy_section": "Assessed",
      "observation_id": "8f7545c5e4d62222e039ba0c42e1641d424b8fdcdf587f11df4b7b835c9684b2",
      "url": "https://x.com/KLoaec/status/2084440673894138236"
    }
  ],
  "platform": "x",
  "queue_rank": 871,
  "retry_history": [],
  "schema": 1,
  "state": "assessed",
  "url": "https://x.com/KLoaec/status/2084440673894138236",
  "verdict": {
    "at": "20260813T131342Z",
    "event_id": "216d2d16b8095fb2f5cd618ecb716aa09770b0e05d88b754236b1d40e03abae9",
    "kind": "dismissed",
    "reason": "already represented by kloaec-slipstream-psbt-tool"
  },
  "verdict_history": [
    {
      "at": "20260813T131342Z",
      "event_id": "216d2d16b8095fb2f5cd618ecb716aa09770b0e05d88b754236b1d40e03abae9",
      "kind": "dismissed",
      "reason": "already represented by kloaec-slipstream-psbt-tool"
    }
  ]
}
