{
  "event_history": [
    {
      "at": "20260813T071733Z",
      "event_id": "ac161552dc9aba65263013dca9ed5e0493e24c17fc35b0e73336b060c4e00d93",
      "observation_id": "6cabf8d110312f2a76e893284d3b4b187c647ca2c5825226c6d4c02cc066b1b2",
      "ordinal": 1539,
      "resulting_state": "pending",
      "state": "pending",
      "type": "observation"
    },
    {
      "at": "20260813T071733Z",
      "event_id": "d100144702293686cb6a94ce8e214e9f9580df323cc1e153bfe2ca11f5a3ec0e",
      "ordinal": 1540,
      "reason": "registered as slowmist-2087438490518892592",
      "resulting_state": "assessed",
      "source_id": "slowmist-2087438490518892592",
      "type": "verdict",
      "verdict": "registered"
    }
  ],
  "first_ordinal": 1539,
  "first_recorded": "20260813T071733Z",
  "head": "d100144702293686cb6a94ce8e214e9f9580df323cc1e153bfe2ca11f5a3ec0e",
  "identity": "x:2087438490518892592",
  "last_ordinal": 1540,
  "last_recorded": "20260813T071733Z",
  "native_id": "2087438490518892592",
  "observations": [
    {
      "legacy_event_time_basis": "verdict-stamp",
      "legacy_line": "- 2026-08-12 [@slowmist_team post (text available during approved intake)](https://x.com/slowmist_team/status/2087438490518892592) (X @slowmist_team) -> registered as slowmist-2087438490518892592 (20260813T071733Z)",
      "legacy_line_number": 815,
      "legacy_path": "DISCOVERY.md",
      "legacy_queue_rank": 781,
      "legacy_section": "Assessed",
      "observation_id": "6cabf8d110312f2a76e893284d3b4b187c647ca2c5825226c6d4c02cc066b1b2",
      "url": "https://x.com/slowmist_team/status/2087438490518892592"
    }
  ],
  "platform": "x",
  "queue_rank": 781,
  "retry_history": [],
  "schema": 1,
  "state": "assessed",
  "url": "https://x.com/slowmist_team/status/2087438490518892592",
  "verdict": {
    "at": "20260813T071733Z",
    "event_id": "d100144702293686cb6a94ce8e214e9f9580df323cc1e153bfe2ca11f5a3ec0e",
    "kind": "registered",
    "reason": "registered as slowmist-2087438490518892592",
    "source_id": "slowmist-2087438490518892592"
  },
  "verdict_history": [
    {
      "at": "20260813T071733Z",
      "event_id": "d100144702293686cb6a94ce8e214e9f9580df323cc1e153bfe2ca11f5a3ec0e",
      "kind": "registered",
      "reason": "registered as slowmist-2087438490518892592",
      "source_id": "slowmist-2087438490518892592"
    }
  ]
}
