{
  "event_history": [
    {
      "at": "20260813T192134Z",
      "event_id": "4a2ed4ffe94aa2a39a240108565a88ee0b1aa55d4b9a2b2e8265f4f3f4269b0c",
      "observation_id": "5f4b2efe56ef34e65df90ee50c9be9f32cdb2aa8eba45d05c1d2b41c0abeb97c",
      "ordinal": 2277,
      "resulting_state": "pending",
      "state": "pending",
      "type": "observation"
    },
    {
      "at": "20260813T192134Z",
      "event_id": "b36f5cb33614f9266091a6fe4060688b3c31c45822a0bab2c65424b1a61552c4",
      "ordinal": 2278,
      "reason": "routine personal reaction with no new factual claim",
      "resulting_state": "assessed",
      "type": "verdict",
      "verdict": "dismissed"
    }
  ],
  "first_ordinal": 2277,
  "first_recorded": "20260813T192134Z",
  "head": "b36f5cb33614f9266091a6fe4060688b3c31c45822a0bab2c65424b1a61552c4",
  "identity": "x:2083005310453907735",
  "last_ordinal": 2278,
  "last_recorded": "20260813T192134Z",
  "native_id": "2083005310453907735",
  "observations": [
    {
      "legacy_event_time_basis": "verdict-stamp",
      "legacy_line": "- 2026-07-31 [@PraveenPerera repost (text available during approved intake)](https://x.com/eric_b_hodln/status/2083005310453907735) (X @PraveenPerera) -> dismissed: routine personal reaction with no new factual claim (20260813T192134Z)",
      "legacy_line_number": 1184,
      "legacy_path": "DISCOVERY.md",
      "legacy_queue_rank": 1150,
      "legacy_section": "Assessed",
      "observation_id": "5f4b2efe56ef34e65df90ee50c9be9f32cdb2aa8eba45d05c1d2b41c0abeb97c",
      "url": "https://x.com/eric_b_hodln/status/2083005310453907735"
    }
  ],
  "platform": "x",
  "queue_rank": 1150,
  "retry_history": [],
  "schema": 1,
  "state": "assessed",
  "url": "https://x.com/eric_b_hodln/status/2083005310453907735",
  "verdict": {
    "at": "20260813T192134Z",
    "event_id": "b36f5cb33614f9266091a6fe4060688b3c31c45822a0bab2c65424b1a61552c4",
    "kind": "dismissed",
    "reason": "routine personal reaction with no new factual claim"
  },
  "verdict_history": [
    {
      "at": "20260813T192134Z",
      "event_id": "b36f5cb33614f9266091a6fe4060688b3c31c45822a0bab2c65424b1a61552c4",
      "kind": "dismissed",
      "reason": "routine personal reaction with no new factual claim"
    }
  ]
}
