{
  "event_history": [
    {
      "at": "20260806T044358Z",
      "event_id": "8696c95a87eea0a95df48b2366761c76dbdaca6bcf957411fb9600e6296665c8",
      "observation_id": "aec6b3cd1e712776fe6ea360eff98043b444a3350fe98e55f18628eb3e7f4d59",
      "ordinal": 554,
      "resulting_state": "pending",
      "state": "pending",
      "type": "observation"
    },
    {
      "at": "20260806T044358Z",
      "event_id": "f6e98462cd97cfba527f3c5065cc1be88ecc867ed5f64d7ea8a8c3c00701875c",
      "ordinal": 555,
      "reason": "no-discussion general seed-construction question for other vendors, already represented by reddit-safe-seed-without-hardware",
      "resulting_state": "assessed",
      "type": "verdict",
      "verdict": "dismissed"
    }
  ],
  "first_ordinal": 554,
  "first_recorded": "20260806T044358Z",
  "head": "f6e98462cd97cfba527f3c5065cc1be88ecc867ed5f64d7ea8a8c3c00701875c",
  "identity": "reddit:1vff6q7",
  "last_ordinal": 555,
  "last_recorded": "20260806T044358Z",
  "native_id": "1vff6q7",
  "observations": [
    {
      "legacy_event_time_basis": "verdict-stamp",
      "legacy_line": "- 2026-08-04 [Is using tails safe enough to create the checksum for a dice generated seed? (For ledger/trezor wallets)](https://www.reddit.com/r/Bitcoin/comments/1vff6q7/is_using_tails_safe_enough_to_create_the_checksum/) by Kindly-Window-8448, 0 comments (r/Bitcoin) -> dismissed: no-discussion general seed-construction question for other vendors, already represented by reddit-safe-seed-without-hardware (20260806T044358Z)",
      "legacy_line_number": 385,
      "legacy_path": "DISCOVERY.md",
      "legacy_queue_rank": 351,
      "legacy_section": "Assessed",
      "observation_id": "aec6b3cd1e712776fe6ea360eff98043b444a3350fe98e55f18628eb3e7f4d59",
      "url": "https://www.reddit.com/r/Bitcoin/comments/1vff6q7/is_using_tails_safe_enough_to_create_the_checksum/"
    }
  ],
  "platform": "reddit",
  "queue_rank": 351,
  "retry_history": [],
  "schema": 1,
  "state": "assessed",
  "url": "https://www.reddit.com/r/Bitcoin/comments/1vff6q7/is_using_tails_safe_enough_to_create_the_checksum/",
  "verdict": {
    "at": "20260806T044358Z",
    "event_id": "f6e98462cd97cfba527f3c5065cc1be88ecc867ed5f64d7ea8a8c3c00701875c",
    "kind": "dismissed",
    "reason": "no-discussion general seed-construction question for other vendors, already represented by reddit-safe-seed-without-hardware"
  },
  "verdict_history": [
    {
      "at": "20260806T044358Z",
      "event_id": "f6e98462cd97cfba527f3c5065cc1be88ecc867ed5f64d7ea8a8c3c00701875c",
      "kind": "dismissed",
      "reason": "no-discussion general seed-construction question for other vendors, already represented by reddit-safe-seed-without-hardware"
    }
  ]
}
