{
  "event_history": [
    {
      "at": "20260815T000000Z",
      "event_id": "19d314f0b3c21348860334deacaec4507eaac98d06567d6c48bdf6370bd708c3",
      "observation_id": "7ded630502caff38fcd2f0a1744473653e8a3de0b1f4efd47eee7392cc56f2e2",
      "ordinal": 3242,
      "resulting_state": "pending",
      "state": "pending",
      "type": "observation"
    }
  ],
  "first_ordinal": 3242,
  "first_recorded": "20260815T000000Z",
  "head": "19d314f0b3c21348860334deacaec4507eaac98d06567d6c48bdf6370bd708c3",
  "identity": "x:2087812404767850585",
  "last_ordinal": 3242,
  "last_recorded": "20260815T000000Z",
  "native_id": "2087812404767850585",
  "observations": [
    {
      "createdAt": "2026-08-15",
      "display_line": "- 2026-08-15 [@callebtc post (text available during approved intake)](https://x.com/callebtc/status/2087812404767850585) (X @callebtc)",
      "foundAt": "2026-08-15",
      "label": "X @callebtc",
      "observation_id": "7ded630502caff38fcd2f0a1744473653e8a3de0b1f4efd47eee7392cc56f2e2",
      "platform": "x",
      "priority": "operator",
      "title": "@callebtc post (text available during approved intake)",
      "url": "https://x.com/callebtc/status/2087812404767850585"
    }
  ],
  "platform": "x",
  "priority": "operator",
  "retry_history": [],
  "schema": 1,
  "state": "pending",
  "url": "https://x.com/callebtc/status/2087812404767850585",
  "verdict_history": []
}
