{
  "event_history": [
    {
      "at": "20260814T015423Z",
      "event_id": "590d22d10489cd282b7ab3d958b81e4f1bee4f04da8cda2f73284b9b60ebec5b",
      "observation_id": "d2e6503e166d784535d1c6202b864b4e80d0cd0a5e9ac98739edbb20c1d83e3a",
      "ordinal": 2874,
      "resulting_state": "pending",
      "state": "pending",
      "type": "observation"
    },
    {
      "at": "20260814T015423Z",
      "event_id": "a2261b04817f7b7c39e5193adc093da96e7e1031eeb85aedfc96f91fbd924727",
      "ordinal": 2875,
      "reason": "registered as ellemouton-ln-closure-dashboard",
      "resulting_state": "assessed",
      "source_id": "ellemouton-ln-closure-dashboard",
      "type": "verdict",
      "verdict": "registered"
    }
  ],
  "first_ordinal": 2874,
  "first_recorded": "20260814T015423Z",
  "head": "a2261b04817f7b7c39e5193adc093da96e7e1031eeb85aedfc96f91fbd924727",
  "identity": "x:2085972151367307708",
  "last_ordinal": 2875,
  "last_recorded": "20260814T015423Z",
  "native_id": "2085972151367307708",
  "observations": [
    {
      "legacy_event_time_basis": "verdict-stamp",
      "legacy_line": "- 2026-08-08 [@OrangeSurfBTC repost (text available during approved intake)](https://x.com/ElleMouton/status/2085972151367307708) (X @OrangeSurfBTC) -> registered as ellemouton-ln-closure-dashboard (20260814T015423Z)",
      "legacy_line_number": 1475,
      "legacy_path": "DISCOVERY.md",
      "legacy_queue_rank": 1441,
      "legacy_section": "Assessed",
      "observation_id": "d2e6503e166d784535d1c6202b864b4e80d0cd0a5e9ac98739edbb20c1d83e3a",
      "url": "https://x.com/ElleMouton/status/2085972151367307708"
    }
  ],
  "platform": "x",
  "queue_rank": 1441,
  "retry_history": [],
  "schema": 1,
  "state": "assessed",
  "url": "https://x.com/ElleMouton/status/2085972151367307708",
  "verdict": {
    "at": "20260814T015423Z",
    "event_id": "a2261b04817f7b7c39e5193adc093da96e7e1031eeb85aedfc96f91fbd924727",
    "kind": "registered",
    "reason": "registered as ellemouton-ln-closure-dashboard",
    "source_id": "ellemouton-ln-closure-dashboard"
  },
  "verdict_history": [
    {
      "at": "20260814T015423Z",
      "event_id": "a2261b04817f7b7c39e5193adc093da96e7e1031eeb85aedfc96f91fbd924727",
      "kind": "registered",
      "reason": "registered as ellemouton-ln-closure-dashboard",
      "source_id": "ellemouton-ln-closure-dashboard"
    }
  ]
}
