{
  "event_history": [
    {
      "at": "20260814T000000Z",
      "event_id": "bfb47000c180e7b0af54ee27903b76c9bee384457af74783bf47b4b52ae75ff0",
      "observation_id": "ad023b8b4a298f578d96c462f6209fdc2931de30123a21597164f394414e303b",
      "ordinal": 2632,
      "resulting_state": "pending",
      "state": "pending",
      "type": "observation"
    }
  ],
  "first_ordinal": 2632,
  "first_recorded": "20260814T000000Z",
  "head": "bfb47000c180e7b0af54ee27903b76c9bee384457af74783bf47b4b52ae75ff0",
  "identity": "x:2088167295453704484",
  "last_ordinal": 2632,
  "last_recorded": "20260814T000000Z",
  "native_id": "2088167295453704484",
  "observations": [
    {
      "legacy_event_time_basis": "source-display-date",
      "legacy_line": "- 2026-08-14 [@katakoto post (text available during approved intake)](https://x.com/katakoto/status/2088167295453704484) (X @katakoto)",
      "legacy_line_number": 63,
      "legacy_path": "DISCOVERY.md",
      "legacy_queue_rank": 32,
      "legacy_section": "Pending",
      "observation_id": "ad023b8b4a298f578d96c462f6209fdc2931de30123a21597164f394414e303b",
      "url": "https://x.com/katakoto/status/2088167295453704484"
    }
  ],
  "platform": "x",
  "queue_rank": 32,
  "retry_history": [],
  "schema": 1,
  "state": "pending",
  "url": "https://x.com/katakoto/status/2088167295453704484",
  "verdict_history": []
}
