{
  "event_history": [
    {
      "at": "20260804T100902Z",
      "event_id": "b15d053934da3afc5265c7a4e6b1b12237f1f4816654e287e4d9418183c3b193",
      "observation_id": "5a164f9293724f062fbc334b58510911350ab1a3f50b23d160329ae5312682ee",
      "ordinal": 324,
      "resulting_state": "pending",
      "state": "pending",
      "type": "observation"
    },
    {
      "at": "20260804T100902Z",
      "event_id": "064bf34695e8b165c22a64e87593ae3113e4770731bd920ea0445c2fb3178075",
      "ordinal": 325,
      "reason": "registered as reddit-coldtruth-opinion",
      "resulting_state": "assessed",
      "source_id": "reddit-coldtruth-opinion",
      "type": "verdict",
      "verdict": "registered"
    }
  ],
  "first_ordinal": 324,
  "first_recorded": "20260804T100902Z",
  "head": "064bf34695e8b165c22a64e87593ae3113e4770731bd920ea0445c2fb3178075",
  "identity": "reddit:1veo7gt",
  "last_ordinal": 325,
  "last_recorded": "20260804T100902Z",
  "native_id": "1veo7gt",
  "observations": [
    {
      "legacy_event_time_basis": "verdict-stamp",
      "legacy_line": "- 2026-08-03 [The ColdTruth](https://www.reddit.com/r/Bitcoin/comments/1veo7gt/the_coldtruth/) by Spy008, 3 comments (r/Bitcoin) -> registered as reddit-coldtruth-opinion (20260804T100902Z)",
      "legacy_line_number": 300,
      "legacy_path": "DISCOVERY.md",
      "legacy_queue_rank": 266,
      "legacy_section": "Assessed",
      "observation_id": "5a164f9293724f062fbc334b58510911350ab1a3f50b23d160329ae5312682ee",
      "url": "https://www.reddit.com/r/Bitcoin/comments/1veo7gt/the_coldtruth/"
    }
  ],
  "platform": "reddit",
  "queue_rank": 266,
  "retry_history": [],
  "schema": 1,
  "state": "assessed",
  "url": "https://www.reddit.com/r/Bitcoin/comments/1veo7gt/the_coldtruth/",
  "verdict": {
    "at": "20260804T100902Z",
    "event_id": "064bf34695e8b165c22a64e87593ae3113e4770731bd920ea0445c2fb3178075",
    "kind": "registered",
    "reason": "registered as reddit-coldtruth-opinion",
    "source_id": "reddit-coldtruth-opinion"
  },
  "verdict_history": [
    {
      "at": "20260804T100902Z",
      "event_id": "064bf34695e8b165c22a64e87593ae3113e4770731bd920ea0445c2fb3178075",
      "kind": "registered",
      "reason": "registered as reddit-coldtruth-opinion",
      "source_id": "reddit-coldtruth-opinion"
    }
  ]
}
