{
  "event_history": [
    {
      "at": "20260813T205229Z",
      "event_id": "77298e9e52a3efd315ebcae92854bd7e4257eecfacdec00e8653b2ee070ba5d8",
      "observation_id": "72c53b1c85ea831b125a95a176721c4caac89cf3d641174a37503a05e668ef04",
      "ordinal": 2367,
      "resulting_state": "pending",
      "state": "pending",
      "type": "observation"
    },
    {
      "at": "20260813T205229Z",
      "event_id": "2c067013743b293f16b1c905cd25dbaad133aa85fa1b69cbce287d5a99bd8a84",
      "ordinal": 2368,
      "reason": "registered as zeusln-lightning-addresses-restored",
      "resulting_state": "assessed",
      "source_id": "zeusln-lightning-addresses-restored",
      "type": "verdict",
      "verdict": "registered"
    }
  ],
  "first_ordinal": 2367,
  "first_recorded": "20260813T205229Z",
  "head": "2c067013743b293f16b1c905cd25dbaad133aa85fa1b69cbce287d5a99bd8a84",
  "identity": "x:2085565765189505095",
  "last_ordinal": 2368,
  "last_recorded": "20260813T205229Z",
  "native_id": "2085565765189505095",
  "observations": [
    {
      "legacy_event_time_basis": "verdict-stamp",
      "legacy_line": "- 2026-08-07 [@Rob1Ham repost (text available during approved intake)](https://x.com/ZeusLN/status/2085565765189505095) (X @Rob1Ham) -> registered as zeusln-lightning-addresses-restored (20260813T205229Z)",
      "legacy_line_number": 1229,
      "legacy_path": "DISCOVERY.md",
      "legacy_queue_rank": 1195,
      "legacy_section": "Assessed",
      "observation_id": "72c53b1c85ea831b125a95a176721c4caac89cf3d641174a37503a05e668ef04",
      "url": "https://x.com/ZeusLN/status/2085565765189505095"
    }
  ],
  "platform": "x",
  "queue_rank": 1195,
  "retry_history": [],
  "schema": 1,
  "state": "assessed",
  "url": "https://x.com/ZeusLN/status/2085565765189505095",
  "verdict": {
    "at": "20260813T205229Z",
    "event_id": "2c067013743b293f16b1c905cd25dbaad133aa85fa1b69cbce287d5a99bd8a84",
    "kind": "registered",
    "reason": "registered as zeusln-lightning-addresses-restored",
    "source_id": "zeusln-lightning-addresses-restored"
  },
  "verdict_history": [
    {
      "at": "20260813T205229Z",
      "event_id": "2c067013743b293f16b1c905cd25dbaad133aa85fa1b69cbce287d5a99bd8a84",
      "kind": "registered",
      "reason": "registered as zeusln-lightning-addresses-restored",
      "source_id": "zeusln-lightning-addresses-restored"
    }
  ]
}
