{
  "event_history": [
    {
      "at": "20260813T145444Z",
      "event_id": "60c1b8d0b5f9ecb05639a8b8c6a321646f81f5889fdb05d1a62f0a0ef7356e7e",
      "observation_id": "eb1a9790ac10682b2f19b54b0f5dc31829e090e135bfbdcb1fe34388e7bf1a2e",
      "ordinal": 1887,
      "resulting_state": "pending",
      "state": "pending",
      "type": "observation"
    },
    {
      "at": "20260813T145444Z",
      "event_id": "b9d775433db899529bcbec2b060ba92eddf46c1b9c78f07feb5da8529406259c",
      "ordinal": 1888,
      "reason": "registered as llfourn-life-savings-move-now",
      "resulting_state": "assessed",
      "source_id": "llfourn-life-savings-move-now",
      "type": "verdict",
      "verdict": "registered"
    }
  ],
  "first_ordinal": 1887,
  "first_recorded": "20260813T145444Z",
  "head": "b9d775433db899529bcbec2b060ba92eddf46c1b9c78f07feb5da8529406259c",
  "identity": "x:2083315485970714695",
  "last_ordinal": 1888,
  "last_recorded": "20260813T145444Z",
  "native_id": "2083315485970714695",
  "observations": [
    {
      "legacy_event_time_basis": "verdict-stamp",
      "legacy_line": "- 2026-07-31 [@LLFOURN post (text available during approved intake)](https://x.com/LLFOURN/status/2083315485970714695) (X @LLFOURN) -> registered as llfourn-life-savings-move-now (20260813T145444Z)",
      "legacy_line_number": 989,
      "legacy_path": "DISCOVERY.md",
      "legacy_queue_rank": 955,
      "legacy_section": "Assessed",
      "observation_id": "eb1a9790ac10682b2f19b54b0f5dc31829e090e135bfbdcb1fe34388e7bf1a2e",
      "url": "https://x.com/LLFOURN/status/2083315485970714695"
    }
  ],
  "platform": "x",
  "queue_rank": 955,
  "retry_history": [],
  "schema": 1,
  "state": "assessed",
  "url": "https://x.com/LLFOURN/status/2083315485970714695",
  "verdict": {
    "at": "20260813T145444Z",
    "event_id": "b9d775433db899529bcbec2b060ba92eddf46c1b9c78f07feb5da8529406259c",
    "kind": "registered",
    "reason": "registered as llfourn-life-savings-move-now",
    "source_id": "llfourn-life-savings-move-now"
  },
  "verdict_history": [
    {
      "at": "20260813T145444Z",
      "event_id": "b9d775433db899529bcbec2b060ba92eddf46c1b9c78f07feb5da8529406259c",
      "kind": "registered",
      "reason": "registered as llfourn-life-savings-move-now",
      "source_id": "llfourn-life-savings-move-now"
    }
  ]
}
