{
  "event_history": [
    {
      "at": "20260813T141728Z",
      "event_id": "8e213bb5718c74ae6a65550f8b92e06e2d3eaf0c34591f22000dc1366d63647f",
      "observation_id": "620ede244cf81ccdc409c42a0169e0b9ad42f1d670d294c5f9c690802c3344f0",
      "ordinal": 1841,
      "resulting_state": "pending",
      "state": "pending",
      "type": "observation"
    },
    {
      "at": "20260813T141728Z",
      "event_id": "93aa6fe30b4ba6b1a9aea66594555b27e41e22bd9868c15085a77f33791b12f2",
      "ordinal": 1842,
      "reason": "generic migration guidance already represented by reddit-where-to-transfer",
      "resulting_state": "assessed",
      "type": "verdict",
      "verdict": "dismissed"
    }
  ],
  "first_ordinal": 1841,
  "first_recorded": "20260813T141728Z",
  "head": "93aa6fe30b4ba6b1a9aea66594555b27e41e22bd9868c15085a77f33791b12f2",
  "identity": "x:2083640095408632083",
  "last_ordinal": 1842,
  "last_recorded": "20260813T141728Z",
  "native_id": "2083640095408632083",
  "observations": [
    {
      "legacy_event_time_basis": "verdict-stamp",
      "legacy_line": "- 2026-08-01 [@KLoaec repost (text available during approved intake)](https://x.com/shaibearary/status/2083640095408632083) (X @KLoaec) -> dismissed: generic migration guidance already represented by reddit-where-to-transfer (20260813T141728Z)",
      "legacy_line_number": 966,
      "legacy_path": "DISCOVERY.md",
      "legacy_queue_rank": 932,
      "legacy_section": "Assessed",
      "observation_id": "620ede244cf81ccdc409c42a0169e0b9ad42f1d670d294c5f9c690802c3344f0",
      "url": "https://x.com/shaibearary/status/2083640095408632083"
    }
  ],
  "platform": "x",
  "queue_rank": 932,
  "retry_history": [],
  "schema": 1,
  "state": "assessed",
  "url": "https://x.com/shaibearary/status/2083640095408632083",
  "verdict": {
    "at": "20260813T141728Z",
    "event_id": "93aa6fe30b4ba6b1a9aea66594555b27e41e22bd9868c15085a77f33791b12f2",
    "kind": "dismissed",
    "reason": "generic migration guidance already represented by reddit-where-to-transfer"
  },
  "verdict_history": [
    {
      "at": "20260813T141728Z",
      "event_id": "93aa6fe30b4ba6b1a9aea66594555b27e41e22bd9868c15085a77f33791b12f2",
      "kind": "dismissed",
      "reason": "generic migration guidance already represented by reddit-where-to-transfer"
    }
  ]
}
