{
  "event_history": [
    {
      "at": "20260806T045258Z",
      "event_id": "09c5346a17b0f70d7b2f41185dbfcbd8cfefa5cbbbd9cccf9e4cc4e0b7423e90",
      "observation_id": "8d3c1ee2bdf54042d5873247afd2447ef27f49a8e2222aa8959d750016901cef",
      "ordinal": 626,
      "resulting_state": "pending",
      "state": "pending",
      "type": "observation"
    },
    {
      "at": "20260806T045258Z",
      "event_id": "98d05bd047384f7d2ac49543dc22cf6eb2b770de5d9d7f7de2df0a56d4be6fd0",
      "ordinal": 627,
      "reason": "repetitive confidence-loss reaction already represented by reddit-self-custody-last-straw and reddit-future-of-bitcoin-debate",
      "resulting_state": "assessed",
      "type": "verdict",
      "verdict": "dismissed"
    }
  ],
  "first_ordinal": 626,
  "first_recorded": "20260806T045258Z",
  "head": "98d05bd047384f7d2ac49543dc22cf6eb2b770de5d9d7f7de2df0a56d4be6fd0",
  "identity": "reddit:1vg8yr9",
  "last_ordinal": 627,
  "last_recorded": "20260806T045258Z",
  "native_id": "1vg8yr9",
  "observations": [
    {
      "legacy_event_time_basis": "verdict-stamp",
      "legacy_line": "- 2026-08-05 [Imagine buying a hardware wallet to protect your BTC then boom, its gone lol](https://www.reddit.com/r/Bitcoin/comments/1vg8yr9/imagine_buying_a_hardware_wallet_to_protect_your/) by Zestyclose-Act-5337, 15 comments (r/Bitcoin) -> dismissed: repetitive confidence-loss reaction already represented by reddit-self-custody-last-straw and reddit-future-of-bitcoin-debate (20260806T045258Z)",
      "legacy_line_number": 406,
      "legacy_path": "DISCOVERY.md",
      "legacy_queue_rank": 372,
      "legacy_section": "Assessed",
      "observation_id": "8d3c1ee2bdf54042d5873247afd2447ef27f49a8e2222aa8959d750016901cef",
      "url": "https://www.reddit.com/r/Bitcoin/comments/1vg8yr9/imagine_buying_a_hardware_wallet_to_protect_your/"
    }
  ],
  "platform": "reddit",
  "queue_rank": 372,
  "retry_history": [],
  "schema": 1,
  "state": "assessed",
  "url": "https://www.reddit.com/r/Bitcoin/comments/1vg8yr9/imagine_buying_a_hardware_wallet_to_protect_your/",
  "verdict": {
    "at": "20260806T045258Z",
    "event_id": "98d05bd047384f7d2ac49543dc22cf6eb2b770de5d9d7f7de2df0a56d4be6fd0",
    "kind": "dismissed",
    "reason": "repetitive confidence-loss reaction already represented by reddit-self-custody-last-straw and reddit-future-of-bitcoin-debate"
  },
  "verdict_history": [
    {
      "at": "20260806T045258Z",
      "event_id": "98d05bd047384f7d2ac49543dc22cf6eb2b770de5d9d7f7de2df0a56d4be6fd0",
      "kind": "dismissed",
      "reason": "repetitive confidence-loss reaction already represented by reddit-self-custody-last-straw and reddit-future-of-bitcoin-debate"
    }
  ]
}
