{
  "event_history": [
    {
      "at": "20260809T144607Z",
      "event_id": "22ea0c16f96361a6bf55ebb1343c49dadeb306ff1c829e505d11ac8d2c84706d",
      "observation_id": "9515b6113408a5b674477e26f00f67e115b738d3a0d19642a17bfb7800fc59aa",
      "ordinal": 1278,
      "resulting_state": "pending",
      "state": "pending",
      "type": "observation"
    },
    {
      "at": "20260809T144607Z",
      "event_id": "f128385f59b4e66a43b04f559d26e22dfe2e278e0d5fa818ba2d2b6788692c1d",
      "ordinal": 1279,
      "reason": "dormant-coin movement with no stated incident connection",
      "resulting_state": "assessed",
      "type": "verdict",
      "verdict": "dismissed"
    }
  ],
  "first_ordinal": 1278,
  "first_recorded": "20260809T144607Z",
  "head": "f128385f59b4e66a43b04f559d26e22dfe2e278e0d5fa818ba2d2b6788692c1d",
  "identity": "x:2083581078564933698",
  "last_ordinal": 1279,
  "last_recorded": "20260809T144607Z",
  "native_id": "2083581078564933698",
  "observations": [
    {
      "legacy_event_time_basis": "verdict-stamp",
      "legacy_line": "- 2026-08-01 [@glxyresearch post (text available during approved intake)](https://x.com/glxyresearch/status/2083581078564933698) (X @glxyresearch) -> dismissed: dormant-coin movement with no stated incident connection (20260809T144607Z)",
      "legacy_line_number": 705,
      "legacy_path": "DISCOVERY.md",
      "legacy_queue_rank": 671,
      "legacy_section": "Assessed",
      "observation_id": "9515b6113408a5b674477e26f00f67e115b738d3a0d19642a17bfb7800fc59aa",
      "url": "https://x.com/glxyresearch/status/2083581078564933698"
    }
  ],
  "platform": "x",
  "queue_rank": 671,
  "retry_history": [],
  "schema": 1,
  "state": "assessed",
  "url": "https://x.com/glxyresearch/status/2083581078564933698",
  "verdict": {
    "at": "20260809T144607Z",
    "event_id": "f128385f59b4e66a43b04f559d26e22dfe2e278e0d5fa818ba2d2b6788692c1d",
    "kind": "dismissed",
    "reason": "dormant-coin movement with no stated incident connection"
  },
  "verdict_history": [
    {
      "at": "20260809T144607Z",
      "event_id": "f128385f59b4e66a43b04f559d26e22dfe2e278e0d5fa818ba2d2b6788692c1d",
      "kind": "dismissed",
      "reason": "dormant-coin movement with no stated incident connection"
    }
  ]
}
