{
  "event_history": [
    {
      "at": "20260809T152207Z",
      "event_id": "314073d635e779e417d2090ca75a8448752d3a457aee3b9ae71320726f635d1f",
      "observation_id": "92b099c9da872c845df9670547ad6f8bd9d6ae12da6cddd98b3e209ab69e507e",
      "ordinal": 1336,
      "resulting_state": "pending",
      "state": "pending",
      "type": "observation"
    },
    {
      "at": "20260809T152207Z",
      "event_id": "6817a745a7390032537a06ba9dfc9bebad4176ff9d524e728deeef9a1519214c",
      "ordinal": 1337,
      "reason": "routine personal sentiment about open-source conduct with no distinct incident record value",
      "resulting_state": "assessed",
      "type": "verdict",
      "verdict": "dismissed"
    }
  ],
  "first_ordinal": 1336,
  "first_recorded": "20260809T152207Z",
  "head": "6817a745a7390032537a06ba9dfc9bebad4176ff9d524e728deeef9a1519214c",
  "identity": "x:2085907352696328607",
  "last_ordinal": 1337,
  "last_recorded": "20260809T152207Z",
  "native_id": "2085907352696328607",
  "observations": [
    {
      "legacy_event_time_basis": "verdict-stamp",
      "legacy_line": "- 2026-08-08 [@jamesob post (text available during approved intake)](https://x.com/jamesob/status/2085907352696328607) (X @jamesob) -> dismissed: routine personal sentiment about open-source conduct with no distinct incident record value (20260809T152207Z)",
      "legacy_line_number": 734,
      "legacy_path": "DISCOVERY.md",
      "legacy_queue_rank": 700,
      "legacy_section": "Assessed",
      "observation_id": "92b099c9da872c845df9670547ad6f8bd9d6ae12da6cddd98b3e209ab69e507e",
      "url": "https://x.com/jamesob/status/2085907352696328607"
    }
  ],
  "platform": "x",
  "queue_rank": 700,
  "retry_history": [],
  "schema": 1,
  "state": "assessed",
  "url": "https://x.com/jamesob/status/2085907352696328607",
  "verdict": {
    "at": "20260809T152207Z",
    "event_id": "6817a745a7390032537a06ba9dfc9bebad4176ff9d524e728deeef9a1519214c",
    "kind": "dismissed",
    "reason": "routine personal sentiment about open-source conduct with no distinct incident record value"
  },
  "verdict_history": [
    {
      "at": "20260809T152207Z",
      "event_id": "6817a745a7390032537a06ba9dfc9bebad4176ff9d524e728deeef9a1519214c",
      "kind": "dismissed",
      "reason": "routine personal sentiment about open-source conduct with no distinct incident record value"
    }
  ]
}
