{
  "event_history": [
    {
      "at": "20260813T000000Z",
      "event_id": "05a084304fc1d9935957343a1e47c627bd9367ad25b7303c8988da6636b553d7",
      "observation_id": "3117f30117f00a979f8f39caed8408dfebe627fc97a47386f3bbeadce70f4ce3",
      "ordinal": 1474,
      "resulting_state": "pending",
      "state": "pending",
      "type": "observation"
    }
  ],
  "first_ordinal": 1474,
  "first_recorded": "20260813T000000Z",
  "head": "05a084304fc1d9935957343a1e47c627bd9367ad25b7303c8988da6636b553d7",
  "identity": "x:2087954922734285084",
  "last_ordinal": 1474,
  "last_recorded": "20260813T000000Z",
  "native_id": "2087954922734285084",
  "observations": [
    {
      "legacy_event_time_basis": "source-display-date",
      "legacy_line": "- 2026-08-13 [@RedPandaMining post (text available during approved intake)](https://x.com/RedPandaMining/status/2087954922734285084) (X @RedPandaMining)",
      "legacy_line_number": 67,
      "legacy_path": "DISCOVERY.md",
      "legacy_queue_rank": 36,
      "legacy_section": "Pending",
      "observation_id": "3117f30117f00a979f8f39caed8408dfebe627fc97a47386f3bbeadce70f4ce3",
      "url": "https://x.com/RedPandaMining/status/2087954922734285084"
    }
  ],
  "platform": "x",
  "queue_rank": 36,
  "retry_history": [],
  "schema": 1,
  "state": "pending",
  "url": "https://x.com/RedPandaMining/status/2087954922734285084",
  "verdict_history": []
}
