{
  "event_history": [
    {
      "at": "20260813T155335Z",
      "event_id": "08fb56f442632b7b4dccac21eec1cebeaa122676ebeb0899677257ec79584a69",
      "observation_id": "dca8b08a6725b8d46d47be1820e0db3f3a530680e223a62618f07964241f87f4",
      "ordinal": 1971,
      "resulting_state": "pending",
      "state": "pending",
      "type": "observation"
    },
    {
      "at": "20260813T155335Z",
      "event_id": "ccc90df2314877079edbde304a708e57b142714e5c72544da66cfa5702869a42",
      "ordinal": 1972,
      "reason": "registered as lopp-bitcoin-days-destroyed",
      "resulting_state": "assessed",
      "source_id": "lopp-bitcoin-days-destroyed",
      "type": "verdict",
      "verdict": "registered"
    }
  ],
  "first_ordinal": 1971,
  "first_recorded": "20260813T155335Z",
  "head": "ccc90df2314877079edbde304a708e57b142714e5c72544da66cfa5702869a42",
  "identity": "x:2083591099998675333",
  "last_ordinal": 1972,
  "last_recorded": "20260813T155335Z",
  "native_id": "2083591099998675333",
  "observations": [
    {
      "legacy_event_time_basis": "verdict-stamp",
      "legacy_line": "- 2026-08-01 [@lopp post (text available during approved intake)](https://x.com/lopp/status/2083591099998675333) (X @lopp) -> registered as lopp-bitcoin-days-destroyed (20260813T155335Z)",
      "legacy_line_number": 1031,
      "legacy_path": "DISCOVERY.md",
      "legacy_queue_rank": 997,
      "legacy_section": "Assessed",
      "observation_id": "dca8b08a6725b8d46d47be1820e0db3f3a530680e223a62618f07964241f87f4",
      "url": "https://x.com/lopp/status/2083591099998675333"
    }
  ],
  "platform": "x",
  "queue_rank": 997,
  "retry_history": [],
  "schema": 1,
  "state": "assessed",
  "url": "https://x.com/lopp/status/2083591099998675333",
  "verdict": {
    "at": "20260813T155335Z",
    "event_id": "ccc90df2314877079edbde304a708e57b142714e5c72544da66cfa5702869a42",
    "kind": "registered",
    "reason": "registered as lopp-bitcoin-days-destroyed",
    "source_id": "lopp-bitcoin-days-destroyed"
  },
  "verdict_history": [
    {
      "at": "20260813T155335Z",
      "event_id": "ccc90df2314877079edbde304a708e57b142714e5c72544da66cfa5702869a42",
      "kind": "registered",
      "reason": "registered as lopp-bitcoin-days-destroyed",
      "source_id": "lopp-bitcoin-days-destroyed"
    }
  ]
}
