{
  "event_history": [
    {
      "at": "20260813T234947Z",
      "event_id": "6619c29d1f134af6bb91962f02441e11a11a7854db58ff1fddff9bd2e17dd539",
      "observation_id": "3e4b2a74ee2664a0b105131f7dababd4c33dc0fb6caaa6f1ca2f62ed2ac6523b",
      "ordinal": 2609,
      "resulting_state": "pending",
      "state": "pending",
      "type": "observation"
    },
    {
      "at": "20260813T234947Z",
      "event_id": "7c629ca3b90f3d7d7bad8c426525308a724da82a813c75599eb1fee2d85499ce",
      "ordinal": 2610,
      "reason": "routine pricing announcement with no incident-specific claim",
      "resulting_state": "assessed",
      "type": "verdict",
      "verdict": "dismissed"
    }
  ],
  "first_ordinal": 2609,
  "first_recorded": "20260813T234947Z",
  "head": "7c629ca3b90f3d7d7bad8c426525308a724da82a813c75599eb1fee2d85499ce",
  "identity": "x:2085819020259782963",
  "last_ordinal": 2610,
  "last_recorded": "20260813T234947Z",
  "native_id": "2085819020259782963",
  "observations": [
    {
      "legacy_event_time_basis": "verdict-stamp",
      "legacy_line": "- 2026-08-07 [@AnchorWatch post (text available during approved intake)](https://x.com/AnchorWatch/status/2085819020259782963) (X @AnchorWatch) -> dismissed: routine pricing announcement with no incident-specific claim (20260813T234947Z)",
      "legacy_line_number": 1350,
      "legacy_path": "DISCOVERY.md",
      "legacy_queue_rank": 1316,
      "legacy_section": "Assessed",
      "observation_id": "3e4b2a74ee2664a0b105131f7dababd4c33dc0fb6caaa6f1ca2f62ed2ac6523b",
      "url": "https://x.com/AnchorWatch/status/2085819020259782963"
    }
  ],
  "platform": "x",
  "queue_rank": 1316,
  "retry_history": [],
  "schema": 1,
  "state": "assessed",
  "url": "https://x.com/AnchorWatch/status/2085819020259782963",
  "verdict": {
    "at": "20260813T234947Z",
    "event_id": "7c629ca3b90f3d7d7bad8c426525308a724da82a813c75599eb1fee2d85499ce",
    "kind": "dismissed",
    "reason": "routine pricing announcement with no incident-specific claim"
  },
  "verdict_history": [
    {
      "at": "20260813T234947Z",
      "event_id": "7c629ca3b90f3d7d7bad8c426525308a724da82a813c75599eb1fee2d85499ce",
      "kind": "dismissed",
      "reason": "routine pricing announcement with no incident-specific claim"
    }
  ]
}
