{
  "event_history": [
    {
      "at": "20260809T021443Z",
      "event_id": "fd48b473e04e528737249f21198ea3ca622742efce99c0f3c6492e0d0cf83201",
      "observation_id": "06095c75e8cb2f0e6653724092fd62b67cfb870672af31e72917a1c9eed88eef",
      "ordinal": 1112,
      "resulting_state": "pending",
      "state": "pending",
      "type": "observation"
    },
    {
      "at": "20260809T021443Z",
      "event_id": "f3272d5157504ed6a711292f4c1483530c95a892e8034a0d31fc34d66fd66762",
      "ordinal": 1113,
      "reason": "astrological framing with no factual or technical record value",
      "resulting_state": "assessed",
      "type": "verdict",
      "verdict": "dismissed"
    }
  ],
  "first_ordinal": 1112,
  "first_recorded": "20260809T021443Z",
  "head": "f3272d5157504ed6a711292f4c1483530c95a892e8034a0d31fc34d66fd66762",
  "identity": "x:2086134060724765000",
  "last_ordinal": 1113,
  "last_recorded": "20260809T021443Z",
  "native_id": "2086134060724765000",
  "observations": [
    {
      "legacy_event_time_basis": "verdict-stamp",
      "legacy_line": "- 2026-08-08 [@realizingerin post (text available during approved intake)](https://x.com/realizingerin/status/2086134060724765000) (X @realizingerin) -> dismissed: astrological framing with no factual or technical record value (20260809T021443Z)",
      "legacy_line_number": 623,
      "legacy_path": "DISCOVERY.md",
      "legacy_queue_rank": 589,
      "legacy_section": "Assessed",
      "observation_id": "06095c75e8cb2f0e6653724092fd62b67cfb870672af31e72917a1c9eed88eef",
      "url": "https://x.com/realizingerin/status/2086134060724765000"
    }
  ],
  "platform": "x",
  "queue_rank": 589,
  "retry_history": [],
  "schema": 1,
  "state": "assessed",
  "url": "https://x.com/realizingerin/status/2086134060724765000",
  "verdict": {
    "at": "20260809T021443Z",
    "event_id": "f3272d5157504ed6a711292f4c1483530c95a892e8034a0d31fc34d66fd66762",
    "kind": "dismissed",
    "reason": "astrological framing with no factual or technical record value"
  },
  "verdict_history": [
    {
      "at": "20260809T021443Z",
      "event_id": "f3272d5157504ed6a711292f4c1483530c95a892e8034a0d31fc34d66fd66762",
      "kind": "dismissed",
      "reason": "astrological framing with no factual or technical record value"
    }
  ]
}
