{
  "event_history": [
    {
      "at": "20260813T232855Z",
      "event_id": "5df4c60e26e82bcc8e2e919ecaedc941d3e87171b5d3df543d3f4891879fe70d",
      "observation_id": "115852af76d7988a0404bb4e547f29f946ef2f193cb343f12f593e472ff63050",
      "ordinal": 2571,
      "resulting_state": "pending",
      "state": "pending",
      "type": "observation"
    },
    {
      "at": "20260813T232855Z",
      "event_id": "4c3733492d3a07b3e9baf17c7efb08a33b549db62bf4f3aaf7b49237160e076d",
      "ordinal": 2572,
      "reason": "insubstantial Satoshi-entropy remark, no new claim",
      "resulting_state": "assessed",
      "type": "verdict",
      "verdict": "dismissed"
    }
  ],
  "first_ordinal": 2571,
  "first_recorded": "20260813T232855Z",
  "head": "4c3733492d3a07b3e9baf17c7efb08a33b549db62bf4f3aaf7b49237160e076d",
  "identity": "x:2083993871214600646",
  "last_ordinal": 2572,
  "last_recorded": "20260813T232855Z",
  "native_id": "2083993871214600646",
  "observations": [
    {
      "legacy_event_time_basis": "verdict-stamp",
      "legacy_line": "- 2026-08-02 [@studentofthings post (text available during approved intake)](https://x.com/studentofthings/status/2083993871214600646) (X @studentofthings) -> dismissed: insubstantial Satoshi-entropy remark, no new claim (20260813T232855Z)",
      "legacy_line_number": 1331,
      "legacy_path": "DISCOVERY.md",
      "legacy_queue_rank": 1297,
      "legacy_section": "Assessed",
      "observation_id": "115852af76d7988a0404bb4e547f29f946ef2f193cb343f12f593e472ff63050",
      "url": "https://x.com/studentofthings/status/2083993871214600646"
    }
  ],
  "platform": "x",
  "queue_rank": 1297,
  "retry_history": [],
  "schema": 1,
  "state": "assessed",
  "url": "https://x.com/studentofthings/status/2083993871214600646",
  "verdict": {
    "at": "20260813T232855Z",
    "event_id": "4c3733492d3a07b3e9baf17c7efb08a33b549db62bf4f3aaf7b49237160e076d",
    "kind": "dismissed",
    "reason": "insubstantial Satoshi-entropy remark, no new claim"
  },
  "verdict_history": [
    {
      "at": "20260813T232855Z",
      "event_id": "4c3733492d3a07b3e9baf17c7efb08a33b549db62bf4f3aaf7b49237160e076d",
      "kind": "dismissed",
      "reason": "insubstantial Satoshi-entropy remark, no new claim"
    }
  ]
}
