{
  "event_history": [
    {
      "at": "20260804T091253Z",
      "event_id": "e4ee8cf8e8c339b7a29bab8635a6756b61215579b24edfe57da0317160fd4b1e",
      "observation_id": "d78166ee71fb3073cb09c1e346c2e99d42b0a6455df62848090168919f0121aa",
      "ordinal": 136,
      "resulting_state": "pending",
      "state": "pending",
      "type": "observation"
    },
    {
      "at": "20260804T091253Z",
      "event_id": "cd595ac470e1a5beea0d8822e420680eed29b9db36300f5a78c179655ae9c659",
      "ordinal": 137,
      "reason": "registered as reddit-ai-code-review-suggestion",
      "resulting_state": "assessed",
      "source_id": "reddit-ai-code-review-suggestion",
      "type": "verdict",
      "verdict": "registered"
    }
  ],
  "first_ordinal": 136,
  "first_recorded": "20260804T091253Z",
  "head": "cd595ac470e1a5beea0d8822e420680eed29b9db36300f5a78c179655ae9c659",
  "identity": "reddit:1vbtwhb",
  "last_ordinal": 137,
  "last_recorded": "20260804T091253Z",
  "native_id": "1vbtwhb",
  "observations": [
    {
      "legacy_event_time_basis": "verdict-stamp",
      "legacy_line": "- 2026-07-31 [A thought for the Future](https://www.reddit.com/r/coldcard/comments/1vbtwhb/a_thought_for_the_future/) by Mission-Disaster-447, 5 comments (r/coldcard) -> registered as reddit-ai-code-review-suggestion (20260804T091253Z)",
      "legacy_line_number": 206,
      "legacy_path": "DISCOVERY.md",
      "legacy_queue_rank": 172,
      "legacy_section": "Assessed",
      "observation_id": "d78166ee71fb3073cb09c1e346c2e99d42b0a6455df62848090168919f0121aa",
      "url": "https://www.reddit.com/r/coldcard/comments/1vbtwhb/a_thought_for_the_future/"
    }
  ],
  "platform": "reddit",
  "queue_rank": 172,
  "retry_history": [],
  "schema": 1,
  "state": "assessed",
  "url": "https://www.reddit.com/r/coldcard/comments/1vbtwhb/a_thought_for_the_future/",
  "verdict": {
    "at": "20260804T091253Z",
    "event_id": "cd595ac470e1a5beea0d8822e420680eed29b9db36300f5a78c179655ae9c659",
    "kind": "registered",
    "reason": "registered as reddit-ai-code-review-suggestion",
    "source_id": "reddit-ai-code-review-suggestion"
  },
  "verdict_history": [
    {
      "at": "20260804T091253Z",
      "event_id": "cd595ac470e1a5beea0d8822e420680eed29b9db36300f5a78c179655ae9c659",
      "kind": "registered",
      "reason": "registered as reddit-ai-code-review-suggestion",
      "source_id": "reddit-ai-code-review-suggestion"
    }
  ]
}
