{
  "event_history": [
    {
      "at": "20260813T000000Z",
      "event_id": "8e7d4b1cdd67e0392be1f838aff0357998fad8ad85753d07186e55d7304268b4",
      "observation_id": "447ee97f11991e36c07c36e9f6add7c29e64e57bc3aeed746acf81ca09b63fc3",
      "ordinal": 1462,
      "resulting_state": "pending",
      "state": "pending",
      "type": "observation"
    },
    {
      "at": "20260815T014735Z",
      "event_id": "b30e65a6bc36412db1efe56606b0217f92aec19743eea480fe8f3d5f5d3a25f3",
      "expected_head": "8e7d4b1cdd67e0392be1f838aff0357998fad8ad85753d07186e55d7304268b4",
      "ordinal": 3183,
      "reason": "general wallet-recovery classification, not about the COLDCARD incident",
      "resulting_state": "assessed",
      "type": "verdict",
      "verdict": "dismissed"
    }
  ],
  "first_ordinal": 1462,
  "first_recorded": "20260813T000000Z",
  "head": "b30e65a6bc36412db1efe56606b0217f92aec19743eea480fe8f3d5f5d3a25f3",
  "identity": "reddit:1vneshc",
  "last_ordinal": 3183,
  "last_recorded": "20260815T014735Z",
  "native_id": "1vneshc",
  "observations": [
    {
      "legacy_event_time_basis": "source-display-date",
      "legacy_line": "- 2026-08-13 [I classified 551 wallet-recovery questions on Bitcoin Stack Exchange. Only 5 were about losing a seed word.](https://www.reddit.com/r/Bitcoin/comments/1vneshc/i_classified_551_walletrecovery_questions_on/) by 12PALABRAS, 12 comments (r/Bitcoin) [body]",
      "legacy_line_number": 46,
      "legacy_path": "DISCOVERY.md",
      "legacy_queue_rank": 15,
      "legacy_section": "Pending",
      "observation_id": "447ee97f11991e36c07c36e9f6add7c29e64e57bc3aeed746acf81ca09b63fc3",
      "url": "https://www.reddit.com/r/Bitcoin/comments/1vneshc/i_classified_551_walletrecovery_questions_on/"
    }
  ],
  "platform": "reddit",
  "queue_rank": 15,
  "retry_history": [],
  "schema": 1,
  "state": "assessed",
  "url": "https://www.reddit.com/r/Bitcoin/comments/1vneshc/i_classified_551_walletrecovery_questions_on/",
  "verdict": {
    "at": "20260815T014735Z",
    "event_id": "b30e65a6bc36412db1efe56606b0217f92aec19743eea480fe8f3d5f5d3a25f3",
    "kind": "dismissed",
    "reason": "general wallet-recovery classification, not about the COLDCARD incident"
  },
  "verdict_history": [
    {
      "at": "20260815T014735Z",
      "event_id": "b30e65a6bc36412db1efe56606b0217f92aec19743eea480fe8f3d5f5d3a25f3",
      "kind": "dismissed",
      "reason": "general wallet-recovery classification, not about the COLDCARD incident"
    }
  ]
}
